{
  "schema": "sns.runtime-manifest.v1",
  "timezone": "America/Denver",
  "bootstrap_prompt": "automation/prompts/bootstrap.v1.md",
  "loops": [
    {
      "loop_id": "daily-governance-triage",
      "automation_title": "SNS Pre-Game Triage",
      "scheduler_managed": true,
      "desired_enabled": true,
      "timing_mode": "flexible_schedule",
      "schedule": "BEGIN:VEVENT\nDTSTART:20260808T100000\nRRULE:FREQ=WEEKLY;BYDAY=MO,TU,WE,TH,FR,SA;BYHOUR=10;BYMINUTE=0;BYSECOND=0\nEND:VEVENT",
      "order": 10
    },
    {
      "loop_id": "daily-research-operator",
      "automation_title": "SNS Daily Research Operator",
      "scheduler_managed": true,
      "desired_enabled": true,
      "timing_mode": "exact_schedule",
      "schedule": "BEGIN:VEVENT\nDTSTART:20260711T130000\nRRULE:FREQ=WEEKLY;BYDAY=MO,TU,WE,TH,FR,SA;BYHOUR=13;BYMINUTE=0;BYSECOND=0\nEND:VEVENT",
      "order": 20
    },
    {
      "loop_id": "post-game-research",
      "automation_title": "SNS Post-Game Research",
      "scheduler_managed": true,
      "desired_enabled": true,
      "timing_mode": "exact_schedule",
      "schedule": "BEGIN:VEVENT\nDTSTART:20261102T160000\nRRULE:FREQ=WEEKLY;BYDAY=MO,TU,WE,TH,FR,SA;BYHOUR=16;BYMINUTE=0;BYSECOND=0\nEND:VEVENT",
      "order": 25
    },
    {
      "loop_id": "weekly-evidence-synthesis",
      "automation_title": "SNS Weekly Research Delivery",
      "scheduler_managed": true,
      "desired_enabled": true,
      "timing_mode": "exact_schedule",
      "schedule": "BEGIN:VEVENT\nDTSTART:20260712T090000\nRRULE:FREQ=WEEKLY;BYDAY=SU;BYHOUR=9;BYMINUTE=0;BYSECOND=0\nEND:VEVENT",
      "order": 30
    },
    {
      "loop_id": "monthly-governance",
      "automation_title": "SNS Monthly Governance",
      "scheduler_managed": true,
      "desired_enabled": false,
      "timing_mode": "flexible_schedule",
      "schedule": "BEGIN:VEVENT\nDTSTART:20260802T110000\nRRULE:FREQ=MONTHLY;BYDAY=SU;BYSETPOS=1;BYHOUR=11;BYMINUTE=0;BYSECOND=0\nEND:VEVENT",
      "order": 40
    },
    {
      "loop_id": "system-audit",
      "automation_title": "SNS System Audit",
      "scheduler_managed": false,
      "desired_enabled": false,
      "timing_mode": "explicit_only",
      "schedule": null,
      "order": 50
    },
    {
      "loop_id": "observatory-projection",
      "automation_title": "SNS Daily Observatory Refresh",
      "scheduler_managed": true,
      "desired_enabled": true,
      "timing_mode": "flexible_schedule",
      "schedule": "BEGIN:VEVENT\nDTSTART:20260731T150000\nRRULE:FREQ=DAILY;BYHOUR=15;BYMINUTE=0;BYSECOND=0\nEND:VEVENT",
      "order": 60
    }
  ],
  "slot_policy": {
    "active_task_limit": 5,
    "external_reserved_task": "none (Aurora Daily Vector replaced by human-authorized Post-Game)",
    "monthly_normal_state": "paused",
    "monthly_review_swap": "Before the Monthly review, pause Observatory and enable Monthly; after accepted disposition, pause Monthly and resume Observatory. Human-authorized scheduler changes only; normal five slots are Pre-Game, Daily, Post-Game, Weekly and Observatory.",
    "review_gate": "2026-10-31 human-approved November floor and independent daily Trio change. November midmonth scientific check Nov 15; policy expires 2026-12-01T07:00:00Z."
  }
}
